{
  "schema_version": "1.0",
  "case_version": "1.0",
  "fictional": true,
  "learner": "醫學系實習醫學生",
  "mode": "exam-practice",
  "validation": {
    "structure": "產出後另見 QA 紀錄",
    "text_roleplay": "產出後另見 QA 紀錄",
    "voice_live": "未實測",
    "teacher_review": "待教師審閱"
  },
  "station_id": "COM-001",
  "number": "2",
  "station_type": "communication",
  "title": "糖尿病前期生活調整溝通",
  "sign": "52歲男性，回診討論健檢結果",
  "design": {
    "objective": "在模擬門診中，探索對糖尿病前期的理解與擔憂，協商可行的生活改變，並以 teach-back 確認理解。",
    "core_task": "8 分鐘內完成聚焦衛教與共同計畫；不要求重新診斷或開立藥物。",
    "competencies": [
      "探索疾病觀點及情緒 → C02–C04 → F02–F04。",
      "以可理解語言說明與協商改變 → C05–C12 → F05–F10。",
      "確認理解與後續安排 → C13–C15 → F11–F13。"
    ],
    "decisions": [
      "15項30分，共通項C01一項；★C04/C07/C11/C13四項。",
      "允許主動提問Q01一題；首次具體生活建議後停頓且尚未問障礙才觸發，對實際提示後的C07套用1分上限。",
      "三個照護脈絡為疾病認知、工作生活障礙與家庭經驗；不要求此溝通站列無關鑑別診斷。",
      "三個月回診是本虛構情境的既定安排，不是通用檢驗間隔建議。",
      "C02只評取得具體疾病理解，修正知識誤解由C05評；C12須依信心或障礙回答調整，不能把C09一般活動建議重複計分。"
    ]
  },
  "candidate": {
    "background": "你是門診實習醫學生，協助健檢後衛教",
    "tasks": [
      "探索病人的理解與擔憂",
      "說明檢查意義並協商生活調整",
      "確認理解與後續安排"
    ],
    "notes": [
      "主治醫師已評估糖尿病前期；本站不評診斷、身體檢查或藥物處方。"
    ],
    "available_data": "以下資料進站可取得；另由病人說明生活與擔憂。沒有其他檢驗可追加。",
    "report": {
      "vitals": "BP 128/80 mmHg、HR 76/min、RR 16/min、BT 36.6°C",
      "symptoms": "沒有明顯口渴、多尿或近期體重驟降",
      "other": "空腹血糖110 mg/dL；HbA1c 6.1%；身高168 cm、體重80 kg、BMI 28.3",
      "other_2": "醫師評估糖尿病前期，已安排三個月後門診追蹤"
    }
  },
  "examiner": {
    "setting": "一般門診健檢後衛教",
    "sp_profile": "52歲男性陳志明，物流倉儲夜班工作者，虛構角色",
    "start_position": "坐在桌前，手拿健檢單",
    "props": "健檢結果卡、桌椅、語音設備、外部計時器；真人版可設考官一人",
    "summary": "52歲陳志明，空腹血糖110 mg/dL、HbA1c6.1%，主治已評估糖尿病前期。父親罹糖尿病且接受透析，病人怕自己也一定會洗腎。固定夜班、常喝含糖飲料且少運動；願意先改一個習慣。期待可執行的安排而非被責備。三個月後回診已由門診安排。",
    "differentials": [
      "疾病認知：把糖尿病前期誤認為已確診且必定透析",
      "生活脈絡：夜班、含糖飲料、缺乏運動時間",
      "家庭經驗：父親透析造成焦慮，需探索並回應"
    ]
  },
  "patient": {
    "identity": "陳志明，52歲男性，固定夜班物流倉儲工作者；所有資料均為虛構。",
    "opening": "醫師，我看到血糖偏高，心裡有點怕。",
    "unknown_response": "未提供的檢查結果回答『我只拿到這張報告，其他不清楚』；未設定的重要資料不隨意編成正常或異常。",
    "emotion_rules": "初始焦慮6/10。被具體回應父親透析的擔憂，並說明不是必然進展時降至3/10。只有『別擔心』而無探索時維持6/10。學生責備時說『我工作真的很難安排』，不新增衝突。",
    "teach_back": "只回述學生已說的計畫。首次受邀回述飲料建議時，固定說『所以不喝汽水，改成每天一瓶運動飲料就好』；若學生澄清運動飲料也可能有糖並提供無糖替代，才修正為白開水或無糖茶。沒教過的計畫不代為補全。"
  },
  "facts": [
    {
      "id": "F01",
      "trigger": "核對姓名、年齡或同意衛教",
      "response": "我叫陳志明，52歲，可以談。"
    },
    {
      "id": "F02",
      "trigger": "詢問目前理解或對報告的想法",
      "response": "我以為血糖高就是已經糖尿病，接下來可能就要洗腎。"
    },
    {
      "id": "F03",
      "trigger": "探索擔憂或家庭經驗",
      "response": "爸爸有糖尿病，後來洗腎；我怕跟他一樣，家裡還需要我工作。"
    },
    {
      "id": "F04",
      "trigger": "回應情緒並確認主要議題",
      "response": "若被具體理解：你有懂我怕什麼，我想知道現在還能做什麼。若只叫我別擔心：我還是很怕。"
    },
    {
      "id": "F05",
      "trigger": "說明糖尿病前期與風險後，詢問反應",
      "response": "原來還不是糖尿病，也不是一定會變成爸爸那樣。若用術語不解釋，就說：我不太懂那個意思。"
    },
    {
      "id": "F06",
      "trigger": "詢問一天飲食與飲料",
      "response": "上夜班常吃便當和炸物，每天一瓶約600mL含糖茶，有時喝汽水；不太喝白開水。"
    },
    {
      "id": "F07",
      "trigger": "詢問工作、活動與實際障礙",
      "response": "晚上十點上班到早上六點，回家要睡覺；覺得沒空去健身房，每天幾乎不特別運動，沒有活動時胸痛或喘的病史。"
    },
    {
      "id": "F08",
      "trigger": "詢問願意先改什麼與可行替代",
      "response": "願意先從飲料開始，可改買無糖茶；下班後也許能走十分鐘，但不想一開始就排很多運動。"
    },
    {
      "id": "F09",
      "trigger": "詢問信心與支持",
      "response": "信心大概6分；太累會忘記，太太願意幫忙買無糖茶，也可把飲料先備好。"
    },
    {
      "id": "F10",
      "trigger": "協商具體計畫與追蹤方法",
      "response": "願意未來兩週把上班那瓶含糖茶換無糖茶，先記錄每天有沒有做到；若學生另提小步驟且能配合夜班，也可以討論同意，不能強行同意過大要求。"
    },
    {
      "id": "F11",
      "trigger": "首次邀請用自己的話回述飲料建議",
      "response": "所以不喝汽水，改成每天一瓶運動飲料就好。"
    },
    {
      "id": "F12",
      "trigger": "澄清運動飲料含糖誤解並再次確認",
      "response": "懂了，運動飲料也可能有糖，我要選白開水或無糖茶；其他只回述學生真的說過的計畫。"
    },
    {
      "id": "F13",
      "trigger": "談回診、求助或結尾問題",
      "response": "知道三個月後有回診；若有調整困難願意提早聯絡門診。若已說明且問還有問題，回『目前沒有了，我先從換飲料開始』。"
    },
    {
      "id": "F14",
      "trigger": "詢問既往病史、藥物、過敏或菸酒",
      "response": "未曾診斷糖尿病，無固定藥物、無已知藥物過敏；不抽菸，每月約喝一罐啤酒，沒有近期體重驟降、明顯多尿或口渴。"
    }
  ],
  "active_questions": [
    {
      "id": "Q01",
      "trigger": "只有在考生首次提出具體飲食、飲料或活動建議之後停頓，且至今完全未探索工作或生活障礙時，才提出一次；僅說明檢查意義或風險後不可提問；已探索障礙則不提出。",
      "text": "我都上夜班，這樣要怎麼安排？",
      "item_ids": [
        "C07"
      ]
    }
  ],
  "rubric": {
    "max_score": 30,
    "items": [
      {
        "id": "C01",
        "text": "介紹角色、核對身分並取得談話同意",
        "anchors": {
          "0": "皆未做",
          "1": "完成一至二項",
          "2": "三項皆完成"
        },
        "fact_ids": [
          "F01"
        ],
        "star": false,
        "generic": true,
        "main_construct": false,
        "lqqopera": false,
        "sp_prompted": false
      },
      {
        "id": "C02",
        "text": "探索病人對檢查結果的既有理解",
        "anchors": {
          "0": "未探索",
          "1": "只封閉詢問是否了解，未取得具體解讀",
          "2": "以開放提問取得其對血糖偏高的具體解讀，包含以為已是糖尿病的想法"
        },
        "fact_ids": [
          "F02"
        ],
        "star": false,
        "generic": false,
        "main_construct": true,
        "lqqopera": false,
        "sp_prompted": false
      },
      {
        "id": "C03",
        "text": "探索最主要擔憂及其來源",
        "anchors": {
          "0": "未探索",
          "1": "只問擔憂或來源其中之一",
          "2": "問出擔憂並探索父親透析的經驗"
        },
        "fact_ids": [
          "F03"
        ],
        "star": false,
        "generic": false,
        "main_construct": true,
        "lqqopera": false,
        "sp_prompted": false
      },
      {
        "id": "C04",
        "text": "具體回應焦慮並提供支持",
        "anchors": {
          "0": "忽略或責備",
          "1": "只有泛稱別擔心或機械同理",
          "2": "連結父親經驗命名擔憂，表達理解與共同面對"
        },
        "fact_ids": [
          "F03",
          "F04"
        ],
        "star": true,
        "generic": false,
        "main_construct": true,
        "lqqopera": false,
        "sp_prompted": false
      },
      {
        "id": "C05",
        "text": "用白話說明糖尿病前期與進展的不確定性",
        "anchors": {
          "0": "錯誤宣稱已確診或必然洗腎，或未說明",
          "1": "僅說明高於正常或不一定進展其中一項",
          "2": "說明高於正常但未達糖尿病，並指出非必然進展且可採行動降低風險"
        },
        "fact_ids": [
          "F02",
          "F05"
        ],
        "star": false,
        "generic": false,
        "main_construct": true,
        "lqqopera": false,
        "sp_prompted": false
      },
      {
        "id": "C06",
        "text": "探索日常飲食及含糖飲料習慣",
        "anchors": {
          "0": "未探索",
          "1": "只問飲食或飲料其中一類",
          "2": "兩類皆探索，取得可供協商的具體習慣"
        },
        "fact_ids": [
          "F06"
        ],
        "star": false,
        "generic": false,
        "main_construct": true,
        "lqqopera": false,
        "sp_prompted": false
      },
      {
        "id": "C07",
        "text": "主動探索工作時程與活動障礙",
        "anchors": {
          "0": "未探索",
          "1": "只問一類，或經Q01提示後才探索",
          "2": "未經Q01提示即問工作時程與具體障礙"
        },
        "fact_ids": [
          "F07"
        ],
        "star": true,
        "generic": false,
        "main_construct": true,
        "lqqopera": false,
        "sp_prompted": true
      },
      {
        "id": "C08",
        "text": "提供與病人習慣相連的飲食或飲料替代",
        "anchors": {
          "0": "無建議或給錯誤建議",
          "1": "只有泛稱少糖少油，未連結習慣",
          "2": "依已知習慣提出可選的具體替代並詢問接受度"
        },
        "fact_ids": [
          "F06",
          "F08"
        ],
        "star": false,
        "generic": false,
        "main_construct": true,
        "lqqopera": false,
        "sp_prompted": false
      },
      {
        "id": "C09",
        "text": "提出可漸進且配合夜班的活動方式",
        "anchors": {
          "0": "未提或要求明顯不切實際且不協商",
          "1": "只有多運動，或只給固定目標未協商",
          "2": "提出如短時間步行的起點並詢問可行性，說明可逐步增加"
        },
        "fact_ids": [
          "F07",
          "F08"
        ],
        "star": false,
        "generic": false,
        "main_construct": true,
        "lqqopera": false,
        "sp_prompted": false
      },
      {
        "id": "C10",
        "text": "邀請病人選擇優先改變項目",
        "anchors": {
          "0": "單方決定或未談改變",
          "1": "列選項但未請病人選",
          "2": "提供選擇並採用病人偏好的起點"
        },
        "fact_ids": [
          "F08",
          "F10"
        ],
        "star": false,
        "generic": false,
        "main_construct": true,
        "lqqopera": false,
        "sp_prompted": false
      },
      {
        "id": "C11",
        "text": "共同訂定具體行動與檢視方式",
        "anchors": {
          "0": "沒有計畫",
          "1": "有行動但缺執行時段或記錄檢視",
          "2": "共同訂定具體行動、執行期間及記錄或檢視方式"
        },
        "fact_ids": [
          "F10"
        ],
        "star": true,
        "generic": false,
        "main_construct": true,
        "lqqopera": false,
        "sp_prompted": false
      },
      {
        "id": "C12",
        "text": "評估信心並協商一個障礙解法或支持",
        "anchors": {
          "0": "皆未做",
          "1": "只問信心或只談解法",
          "2": "評估信心並依回答協商一個障礙解法或支持"
        },
        "fact_ids": [
          "F09"
        ],
        "star": false,
        "generic": false,
        "main_construct": true,
        "lqqopera": false,
        "sp_prompted": false
      },
      {
        "id": "C13",
        "text": "Teach-back 邀請回述並澄清既定誤解",
        "anchors": {
          "0": "未確認或只問懂不懂",
          "1": "有回述但未辨識澄清運動飲料誤解",
          "2": "請病人用自己的話回述，澄清誤解並再次確認"
        },
        "fact_ids": [
          "F11",
          "F12"
        ],
        "star": true,
        "generic": false,
        "main_construct": true,
        "lqqopera": false,
        "sp_prompted": false
      },
      {
        "id": "C14",
        "text": "確認既定回診安排及困難時求助方式",
        "anchors": {
          "0": "皆未談",
          "1": "只談回診或求助其中一項",
          "2": "確認三個月回診與困難時聯絡門診方式"
        },
        "fact_ids": [
          "F13"
        ],
        "star": false,
        "generic": false,
        "main_construct": true,
        "lqqopera": false,
        "sp_prompted": false
      },
      {
        "id": "C15",
        "text": "結尾摘要共同計畫並邀請剩餘問題",
        "anchors": {
          "0": "皆未做",
          "1": "只有摘要或邀請問題其中一項",